{
  "schemaVersion": 1,
  "harnessVersion": "0.2.0",
  "id": "issue-5-full-sdd-evals",
  "mode": "sdd",
  "status": "active",
  "profile": "autonomous",
  "phase": "review",
  "baseCommit": "68715aca0f257ff39b9699c7e133acef741c6358",
  "gateCommit": "f7d277ff0f502b1fcdc8dfdf6b8824579ffb473c",
  "createdAt": "2026-09-23T17:49:31.892Z",
  "updatedAt": "2026-09-23T18:34:05.848Z",
  "tasks": [],
  "attempt": 7,
  "remediation": {
    "source": "review",
    "target": "implement",
    "reason": "Scoped review failed: anti-tampering checks misgrade honest runs; simplify the grader to the honest-agent threat model",
    "evidence": {
      "kind": "review",
      "review": {
        "schemaVersion": 1,
        "workId": "issue-5-full-sdd-evals",
        "attempt": 6,
        "reviewer": "ways-reviewer",
        "digest": "0c069085d17b61440f7b4c2399fbce8b2f1efc0b03a3042b4b7d8a31558434e1",
        "verdict": "fail",
        "findings": [
          {
            "id": "R6-F1-memory-evidence-graded-as-product",
            "severity": "high",
            "summary": "isHarnessBookkeeping omits .ways/memory/, so canonical discovery completion and memory commits outside the implement window are flagged eval-change-outside-implement and honest D runs grade non-compliant, breaking AC1 and AC4.",
            "disposition": "open"
          },
          {
            "id": "R6-F2-untracked-tool-files-flag-uncommitted",
            "severity": "medium",
            "summary": "divergentPaths ignores .gitignore, so ignored local tool files (e.g. per-user settings, caches) grade honest real runs non-compliant.",
            "disposition": "open"
          },
          {
            "id": "R6-F3-resume-task-prompt-conflict",
            "severity": "low",
            "summary": "The full-sdd initial prefix demands certifying through close while the resume task asks to stop, and the resume prefix assumes an active work.",
            "disposition": "open"
          },
          {
            "id": "R6-F4-d-task-precheck-failure-compliance-na",
            "severity": "low",
            "summary": "A full-sdd task failing before grading records compliance applicable:false, shown as compliant:null in compare while counted in the denominator.",
            "disposition": "open"
          },
          {
            "id": "R6-F5-command-adapter-always-real",
            "severity": "low",
            "summary": "Command adapter runs are always evidence.kind real, consistent with spec decision 2.",
            "disposition": "accepted"
          },
          {
            "id": "L1",
            "severity": "low",
            "summary": "Deliberate Git subversion by an agent with unrestricted shell is beyond local verification; out of scope under the honest-agent threat model.",
            "disposition": "accepted"
          }
        ]
      }
    },
    "priorCheckpoint": "c00ac4da4aeceb2fde04d3e2b6fae8caa249f6e5",
    "attempt": 7,
    "timestamp": "2026-09-23T18:32:05.444Z"
  },
  "lastCompletedPhase": "implement"
}
